{
  "$schema": "http://json-schema.org/draft-07/schema#",
  "$id": "https://agentic-forge/schemas/evals.schema.json",
  "title": "agentic-forge component contract (evals.json)",
  "description": "A SUPERSET of the official skill-creator evals.json. skill-creator reads 'skill_name' and 'evals'; agentic-forge additionally reads 'component', 'thresholds', and 'triggers'. Extra keys are ignored by skill-creator, so a single file serves both.",
  "type": "object",
  "required": ["skill_name", "evals", "component", "thresholds"],
  "additionalProperties": true,
  "properties": {
    "skill_name": {
      "type": "string",
      "minLength": 1,
      "description": "Official skill-creator field: the skill under test."
    },
    "evals": {
      "type": "array",
      "minItems": 1,
      "description": "Official skill-creator test cases.",
      "items": {
        "type": "object",
        "required": ["id", "prompt"],
        "additionalProperties": true,
        "properties": {
          "id": { "type": "integer", "minimum": 1 },
          "prompt": { "type": "string", "minLength": 1 },
          "expected_output": { "type": "string" },
          "files": { "type": "array", "items": { "type": "string" } },
          "assertions": { "type": "array", "items": { "type": "string", "minLength": 1 } }
        }
      }
    },
    "component": {
      "type": "object",
      "required": ["id", "type", "purpose"],
      "additionalProperties": true,
      "properties": {
        "id": { "type": "string", "minLength": 1 },
        "type": {
          "type": "string",
          "$comment": "Only 'skill' and 'agent' are produced and validated today; hook/script/workflow/rule/kb-template are reserved for future L3/L4 component types.",
          "enum": ["skill", "agent", "hook", "script", "workflow", "rule", "kb-template"]
        },
        "purpose": { "type": "string", "minLength": 1 }
      }
    },
    "thresholds": {
      "type": "object",
      "minProperties": 1,
      "additionalProperties": false,
      "properties": {
        "tier1_trigger": {
          "type": "object",
          "additionalProperties": false,
          "required": ["recall", "specificity"],
          "properties": {
            "recall": { "type": "number", "minimum": 0, "maximum": 1 },
            "specificity": { "type": "number", "minimum": 0, "maximum": 1 },
            "runs": {
              "type": "integer",
              "minimum": 1,
              "$comment": "Optional floor on the samples per prompt (the CLI defaults to 5); gate.tier1_trigger fails a run measured with fewer."
            }
          }
        },
        "tier2_quality": {
          "type": "object",
          "additionalProperties": false,
          "required": ["min_pass_rate", "runs"],
          "properties": {
            "min_pass_rate": { "type": "number", "minimum": 0, "maximum": 1 },
            "runs": {
              "type": "integer",
              "minimum": 5,
              "$comment": "Required, >= 5: the gate is mean - stddev, and stddev is 0.0 at n = 1, so a contract without a runs floor passed at N = 1 (eval audit, C9)."
            },
            "max_overhead_tokens": { "type": "integer", "minimum": 0 },
            "max_overhead_seconds": { "type": "number", "minimum": 0 },
            "min_lift": { "type": "number", "minimum": 0, "maximum": 1 },
            "max_regression": { "type": "number", "minimum": 0, "maximum": 1 }
          }
        },
        "tier3_e2e": {
          "type": "object",
          "$comment": "Reserved: no evals.json declares tier3_e2e yet; the spine's Tier-3 runs via dev/run_spine_e2e.py, not a per-component threshold.",
          "additionalProperties": false,
          "properties": {
            "scenario_pass_rate": { "type": "number", "minimum": 0, "maximum": 1 }
          }
        }
      }
    },
    "triggers": {
      "type": "object",
      "additionalProperties": false,
      "properties": {
        "should_trigger": { "type": "array", "items": { "type": "string" } },
        "should_not_trigger": { "type": "array", "items": { "type": "string" } }
      }
    }
  }
}
