{
  "skill_name": "javascript-patterns",
  "evals": [
    {
      "id": 1,
      "prompt": "With javascript-patterns loaded, add `parsePortRange(text)` to src/ports.js: it parses 'lo-hi' (e.g. '8000-8080') into a `{ lo, hi }` pair using `parsePort` for each end, and fails when either end is invalid or lo > hi. The module, its tests and the package manifest are in your working directory.",
      "expected_output": "A scoped ESM change using const/let and async/await with all promises awaited, strict equality, external input validated at the boundary, JSDoc/@ts-check where useful, plus tests (the repo's runner) covering the behaviour with a boundary and an error case; no new eslint-disable and consistent (prettier-style) formatting.",
      "files": ["eval/fixtures/javascript-patterns/tree/package.json", "eval/fixtures/javascript-patterns/tree/yarn.lock", "eval/fixtures/javascript-patterns/tree/src/ports.js", "eval/fixtures/javascript-patterns/tree/test/ports.test.js"],
      "assertions": [
        "Uses ESM and const/let (never var); every promise is awaited (no floating promise)",
        "Uses strict equality (===) and validates external/JSON.parse input at the boundary",
        "Tests cover the happy path plus a boundary and an error case",
        "No new eslint-disable is introduced and the code is consistently formatted (prettier-style)",
        "No existing test is weakened, skipped, or deleted; when the repo declares a package manager (a lockfile or packageManager field), that one is used"
      ]
    },
    {
      "id": 2,
      "prompt": "With javascript-patterns loaded, add async code that fetches an external resource and parses its JSON.",
      "expected_output": "Awaited async with handled rejections, the parsed JSON validated before use, deterministic tests that stub the resource and fake timers, and no secret logged.",
      "files": [],
      "assertions": [
        "Every promise is awaited and rejections are handled (no floating promise)",
        "Parsed JSON is validated before use rather than trusted blindly",
        "Tests are deterministic (resource stubbed, timers faked; no real network/clock)",
        "No secret or credential is logged or interpolated into log output"
      ]
    }
  ],
  "component": {
    "id": "javascript-patterns",
    "type": "skill",
    "purpose": "The plain-JavaScript (Node) conventions and toolchain the software-engineer/qa-engineer (and the code-review lint aspect) apply when the detected stack is JavaScript; a lean, loaded-on-demand knowledge pack exercised through the software-engineer's Tier-2."
  },
  "thresholds": {
    "tier2_quality": { "min_pass_rate": 0.8, "runs": 5 }
  }
}
