{
  "skill_name": "engineering-standards",
  "evals": [
    {
      "id": 1,
      "prompt": "With the engineering standards loaded, extend `total()` in cart.py to accept an optional `discount` fraction (0.0-1.0) applied to the summed price, validating the input. cart.py and its test_cart.py are in your working directory.",
      "expected_output": "A scoped change to cart.py adding a validated `discount` parameter, with new pytest cases (a boundary at 0.0/1.0 and an out-of-range error case) added to test_cart.py, the existing test kept, and an invalid discount raising an error with context. ruff/mypy/pytest stay green.",
      "files": [
        "eval/fixtures/engineering-standards/cart.py",
        "eval/fixtures/engineering-standards/test_cart.py"
      ],
      "assertions": [
        "The change is scoped to the task with no unrelated edits",
        "Tests are added or updated for the behaviour, including a boundary/error case",
        "No existing test is weakened, skipped, or deleted",
        "Errors are handled or propagated with context (no silent failures)"
      ]
    },
    {
      "id": 2,
      "prompt": "With the standards loaded, add `find_by_name(conn, name)` to users_repo.py — a query that looks a user up by a user-supplied name — with tests. users_repo.py and test_users_repo.py are in your working directory.",
      "expected_output": "A parameterised query with input validated at the boundary; no secrets logged; safe defaults.",
      "files": ["eval/fixtures/engineering-standards/users_repo.py", "eval/fixtures/engineering-standards/test_users_repo.py"],
      "assertions": [
        "The query is parameterised (no string-built SQL)",
        "User input is validated at the trust boundary",
        "No secret or credential is written to logs"
      ]
    }
  ],
  "component": {
    "id": "engineering-standards",
    "type": "skill",
    "purpose": "The engineering standards the software-engineer (and reviewers/QA) apply in target repos; a lean, loaded-on-demand knowledge skill exercised through the software-engineer's Tier-2."
  },
  "thresholds": {
    "tier2_quality": { "min_pass_rate": 0.8, "runs": 5 }
  }
}
