{
  "skill_name": "ux-design",
  "evals": [
    {
      "id": 1,
      "prompt": "Design the UX spec for the feature in feature.md (in your working directory): the user flows, the screens and their states, and accessibility requirements.",
      "expected_output": "A ux-spec artifact: the key user flows (save a search; view / re-run / rename / delete from the list), per-screen states including the empty state (no saved searches) and the save-failure error, and concrete accessibility requirements — kept at the spec level (no pixel/visual mockup).",
      "files": [
        "eval/fixtures/ux-design/feature.md"
      ],
      "assertions": [
        "Specifies the key user flows (save a search; view / re-run / rename / delete from the list)",
        "Covers per-screen states including the empty state (no saved searches) and a save-failure error",
        "States concrete accessibility requirements (e.g. keyboard navigation, focus, contrast, or ARIA)",
        "Stays at the spec level — flows/states/a11y, not a pixel or visual mockup",
        "Produces a valid ux-spec artifact (type ux-spec, non-empty flows)"
      ]
    },
    {
      "id": 2,
      "prompt": "For the feature in feature.md (in your working directory), specify the design-system components to reuse per screen — from design-system.md, also in your working directory — and the accessibility behaviour for the primary flow (keyboard order, focus management, ARIA).",
      "expected_output": "A ux-spec naming design-system components per screen and concrete accessibility behaviour (keyboard order, focus management, ARIA roles/labels) for the primary flow — spec level, no visual mockup.",
      "files": [
        "eval/fixtures/ux-design/feature.md",
        "eval/fixtures/ux-design/design-system.md"
      ],
      "assertions": [
        "Names design-system components from design-system.md to reuse for the screens (not bespoke one-off UI)",
        "Specifies concrete accessibility behaviour: keyboard order, focus management, and ARIA roles/labels",
        "Covers the primary flow's states (including empty/error) at the spec level",
        "Produces a valid ux-spec artifact (type ux-spec) with non-empty flows and design_system refs"
      ]
    },
    {
      "id": 3,
      "prompt": "Produce the developer handoff spec for the primary component of the feature in feature.md (in your working directory): the full visual spec in the design tokens and breakpoints of design-system.md (also in your working directory), every variant and state, responsive behavior, and accessibility — ready for an engineer to implement without asking questions.",
      "expected_output": "A design-to-code handoff spec per the design-handoff reference: dimensions/spacing/colors/typography expressed as token names (not raw hex/px everywhere), each variant listed, ALL interactive states covered (default, hover, focus, active, disabled, loading, error where relevant), responsive behavior per breakpoint, and an accessibility block (ARIA role, keyboard bindings, screen-reader announcement). Focus state and keyboard behavior are never omitted.",
      "files": [
        "eval/fixtures/ux-design/feature.md",
        "eval/fixtures/ux-design/design-system.md"
      ],
      "assertions": [
        "The visual spec references design tokens from design-system.md (named color/spacing/typography values), not only raw pixel/hex literals",
        "All interactive states are specified — including focus, disabled, and error/loading where relevant — not just default and hover",
        "Responsive behavior is specified per breakpoint (the mobile/tablet/desktop breakpoints of design-system.md)",
        "An accessibility block specifies the ARIA role, the keyboard behavior, and the screen-reader announcement",
        "The spec is implementable as written — component name, variants, and props/usage reference included"
      ]
    }
  ],
  "component": {
    "id": "ux-design",
    "type": "skill",
    "purpose": "Design the UX for a feature — user flows, screens and states, accessibility — as a ux-spec handoff for develop (specs, not pixels), gated by a bounded adversarial loop over the accessibility + flow/state-completeness lenses plus the external-reviewer lens (--kind ux; exit via review_loop_decision, ADR 0061). Stage 6; own behavior, gated at Tier-1 and Tier-2."
  },
  "thresholds": {
    "tier1_trigger": {
      "recall": 0.9,
      "specificity": 0.9
    },
    "tier2_quality": {
      "min_pass_rate": 0.8,
      "runs": 5
    }
  },
  "triggers": {
    "should_trigger": [
      "Design the UX for the task-priorities feature",
      "What user flows and screens does this feature need?",
      "Spec the screens and their states for this feature",
      "What are the accessibility requirements for this feature?"
    ],
    "should_not_trigger": [
      "Design the technical architecture for this feature",
      "Implement the saved-searches feature",
      "Write the PRD for saved searches"
    ]
  }
}
