{
  "skill_name": "example-skill",
  "evals": [
    {
      "id": 1,
      "prompt": "Do the example task.",
      "files": [],
      "assertions": ["The example task is done and the result is reported"]
    }
  ],
  "component": {
    "id": "example-skill",
    "type": "skill",
    "purpose": "Example skill in the plugin skeleton."
  },
  "thresholds": {
    "tier1_trigger": { "recall": 0.9, "specificity": 0.9 },
    "tier2_quality": { "min_pass_rate": 0.8, "runs": 5 }
  },
  "triggers": {
    "should_trigger": ["Do the example task"],
    "should_not_trigger": ["Cut a release and write the changelog"]
  }
}
